mysql> ALTER TABLE Employee_payroll ADD Gender varchar(20);
Query OK, 0 rows affected (0.06 sec)
Records: 0  Duplicates: 0  Warnings: 0

mysql> select * from Employee_payroll;
+----+------+--------+------------+--------+
| id | name | salary | Start_date | Gender |
+----+------+--------+------------+--------+
|  1 | XYZ  | 20K    | 01/07/1999 | NULL   |
|  2 | ABC  | 30K    | 15/5/2002  | NULL   |
|  3 | PQR  | 35K    | 12/12/1992 | NULL   |
+----+------+--------+------------+--------+
3 rows in set (0.00 sec)

mysql> UPDATE Employee_payroll set gender = "M" WHERE name = "XYZ";
Query OK, 1 row affected (0.01 sec)
Rows matched: 1  Changed: 1  Warnings: 0

mysql> select * from Employee_payroll;
+----+------+--------+------------+--------+
| id | name | salary | Start_date | Gender |
+----+------+--------+------------+--------+
|  1 | XYZ  | 20K    | 01/07/1999 | M      |
|  2 | ABC  | 30K    | 15/5/2002  | NULL   |
|  3 | PQR  | 35K    | 12/12/1992 | NULL   |
+----+------+--------+------------+--------+
3 rows in set (0.00 sec)

mysql> UPDATE Employee_payroll set gender = "M" WHERE name = "PQR";
Query OK, 1 row affected (0.01 sec)
Rows matched: 1  Changed: 1  Warnings: 0

mysql> UPDATE Employee_payroll set gender = "F" WHERE name = "ABC";
Query OK, 1 row affected (0.01 sec)
Rows matched: 1  Changed: 1  Warnings: 0

mysql> select * from Employee_payroll;
+----+------+--------+------------+--------+
| id | name | salary | Start_date | Gender |
+----+------+--------+------------+--------+
|  1 | XYZ  | 20K    | 01/07/1999 | M      |
|  2 | ABC  | 30K    | 15/5/2002  | F      |
|  3 | PQR  | 35K    | 12/12/1992 | M      |
+----+------+--------+------------+--------+
3 rows in set (0.00 sec)

mysql> select * from Employee_payroll;
+----+--------+--------+------------+--------+
| id | name   | salary | Start_date | Gender |
+----+--------+--------+------------+--------+
|  1 | XYZ    | 20K    | 01/07/1999 | M      |
|  2 | ABC    | 30K    | 15/5/2002  | F      |
|  3 | PQR    | 35K    | 12/12/1992 | M      |
|  4 | janu   | 40K    | 01/07/1999 | F      |
|  5 | Herose | 45K    | 06/09/1999 | M      |
|  6 | sri    | 40K    | 15/09/2002 | F      |
|  7 | Ram    | 15k    | 07/01/2000 | M      |
+----+--------+--------+------------+--------+
7 rows in set (0.00 sec)

mysql> SELECT SUM(salary) FROM Employee_payroll WHERE Gender = "M" GROUP BY Gender;
+-------------+
| SUM(salary) |
+-------------+
|         115 |
+-------------+
1 row in set, 4 warnings (0.01 sec)

mysql> SELECT SUM(salary) FROM Employee_payroll WHERE Gender = "F" GROUP BY Gender;
+-------------+
| SUM(salary) |
+-------------+
|         110 |
+-------------+
1 row in set, 3 warnings (0.00 sec)

mysql> SELECT AVG(salary) FROM Employee_payroll WHERE Gender = "F" GROUP BY Gender;
+--------------------+
| AVG(salary)        |
+--------------------+
| 36.666666666666664 |
+--------------------+
1 row in set, 3 warnings (0.00 sec)

mysql> SELECT AVG(salary) FROM Employee_payroll WHERE Gender = "M" GROUP BY Gender;
+-------------+
| AVG(salary) |
+-------------+
|       28.75 |
+-------------+
1 row in set, 4 warnings (0.00 sec)

mysql> SELECT COUNT(salary) FROM Employee_payroll WHERE Gender = "M" GROUP BY Gender;
+---------------+
| COUNT(salary) |
+---------------+
|             4 |
+---------------+
1 row in set (0.00 sec)

mysql> SELECT COUNT(salary) FROM Employee_payroll WHERE Gender = "F" GROUP BY Gender;
+---------------+
| COUNT(salary) |
+---------------+
|             3 |
+---------------+
1 row in set (0.00 sec)

mysql> SELECT MIN(salary) AS lowestSalary FROM Employee_payroll;
+--------------+
| lowestSalary |
+--------------+
| 15k          |
+--------------+
1 row in set (0.00 sec)

mysql> SELECT MAX(salary) AS HighestSalary FROM Employee_payroll;
+---------------+
| HighestSalary |
+---------------+
| 45K           |
+---------------+
1 row in set (0.00 sec)